Ingredient,Trade_Name(s),Disease_Category,Duration_Class,Substance_Class,ChEMBL_ID,Gene_Symbol(s),Target_Name(s),Mechanism_of_Action,Action_Type(s),Target_ChEMBL_ID(s),N_Targets,Match_Strategy
NALOXONE HYDROCHLORIDE,KLOXXADO | NALOXONE | NALOXONE HYDROCHLORIDE | NARCAN | REXTOVY | REZENOPY | RIVIVE | ZIMHI,Pain,PERIODIC,chemical,CHEMBL1718,"OPRK1, OPRD1, OPRM1",Opioid receptors; mu/kappa/delta,Opioid receptors; mu/kappa/delta antagonist,ANTAGONIST,CHEMBL2095181,1,direct
NALOXONE HYDROCHLORIDE; PENTAZOCINE HYDROCHLORIDE,NALOXONE HYDROCHLORIDE AND PENTAZOCINE HYDROCHLORIDE,Pain,PERIODIC,chemical,CHEMBL1718 | CHEMBL3989510,"OPRK1, OPRD1, OPRM1 | SIGMAR1",Opioid receptors; mu/kappa/delta | Sigma non-opioid intracellular receptor 1,Opioid receptors; mu/kappa/delta antagonist; Sigma opioid receptor modulator,ANTAGONIST | MODULATOR,CHEMBL2095181; CHEMBL287,2,combination
NALTREXONE,VIVITROL,Pain,CHRONIC,chemical,CHEMBL19019,"OPRK1, OPRD1, OPRM1",Opioid receptors; mu/kappa/delta,Opioid receptors; mu/kappa/delta antagonist,ANTAGONIST,CHEMBL2095181,1,direct
NALTREXONE HYDROCHLORIDE,NALTREXONE HYDROCHLORIDE,Pain,CHRONIC,chemical,CHEMBL1201149,"OPRK1, OPRD1, OPRM1",Opioid receptors; mu/kappa/delta,Opioid receptors; mu/kappa/delta antagonist,ANTAGONIST,CHEMBL2095181,1,direct
NAPHAZOLINE HYDROCHLORIDE; PHENIRAMINE MALEATE,NAPHAZOLINE HYDROCHLORIDE AND PHENIRAMINE MALEATE | NAPHCON-A | OPCON-A | VISINE,Other/Unclassified,OTHER,chemical,CHEMBL1706 | CHEMBL1653,"ADRA1A, ADRA2A, ADRA2C, ADRA1D, ADRA1B, ADRA2B | HRH1",Adrenergic receptor alpha | Histamine H1 receptor,Adrenergic receptor alpha agonist; Histamine H1 receptor antagonist,AGONIST | ANTAGONIST,CHEMBL2095203; CHEMBL231,2,combination
NAPROXEN,EC-NAPROSYN | NAPROSYN | NAPROXEN,Pain,PERIODIC,chemical,CHEMBL154,"PTGS2, PTGS1",Cyclooxygenase,Cyclooxygenase inhibitor,INHIBITOR,CHEMBL2094253,1,direct
NAPROXEN SODIUM,ALEVE | ANAPROX DS | NAPRELAN | NAPROXEN SODIUM,Pain,PERIODIC,chemical,CHEMBL1200806,"PTGS2, PTGS1",Cyclooxygenase,Cyclooxygenase inhibitor,INHIBITOR,CHEMBL2094253,1,direct
NAPROXEN SODIUM; PSEUDOEPHEDRINE HYDROCHLORIDE,NAPROXEN SODIUM AND PSEUDOEPHEDRINE HYDROCHLORIDE,Pain,PERIODIC,chemical,CHEMBL1200806 | CHEMBL1200724,"PTGS2, PTGS1 | SLC6A2",Cyclooxygenase | Sodium-dependent noradrenaline transporter,Cyclooxygenase inhibitor; Norepinephrine transporter releasing agent,INHIBITOR | RELEASING AGENT,CHEMBL2094253; CHEMBL222,2,combination
NAPROXEN SODIUM; SUMATRIPTAN SUCCINATE,SUMATRIPTAN AND NAPROXEN SODIUM | TREXIMET,Pain,PERIODIC,chemical,CHEMBL1200806 | CHEMBL1201150,"PTGS2, PTGS1 | HTR1B | HTR1D",Cyclooxygenase | 5-hydroxytryptamine receptor 1B | 5-hydroxytryptamine receptor 1D,Cyclooxygenase inhibitor; Serotonin 1b (5-HT1b) receptor agonist; Serotonin 1d (5-HT1d) receptor agonist,INHIBITOR | AGONIST,CHEMBL2094253; CHEMBL1898; CHEMBL1983,3,combination
NARATRIPTAN HYDROCHLORIDE,NARATRIPTAN,Neurology,PERIODIC,chemical,CHEMBL1200601,HTR1B | HTR1D,5-hydroxytryptamine receptor 1B | 5-hydroxytryptamine receptor 1D,Serotonin 1b (5-HT1b) receptor agonist; Serotonin 1d (5-HT1d) receptor agonist,AGONIST,CHEMBL1898; CHEMBL1983,2,direct
NATAMYCIN,NATACYN,Infectious,SHORT,chemical,CHEMBL1200656,,Ergosterol,Ergosterol sequestering agent,SEQUESTERING AGENT,CHEMBL2364028,1,direct
NATEGLINIDE,NATEGLINIDE,Metabolic,CHRONIC,chemical,CHEMBL783,"KCNJ11, ABCC8","Sulfonylurea receptor 1, Kir6.2","Sulfonylurea receptor 1, Kir6.2 blocker",BLOCKER,CHEMBL2096972,1,direct
NAVEPEGRITIDE,YUVIWEL,Other/Unclassified,OTHER,protein,,,,,,,0,not_found
NEBIVOLOL HYDROCHLORIDE,BYSTOLIC | NEBIVOLOL HYDROCHLORIDE,Cardiovascular,CHRONIC,chemical,CHEMBL1201731,ADRB1 | ADRB2,Beta-1 adrenergic receptor | Beta-2 adrenergic receptor,Beta-1 adrenergic receptor antagonist; Beta-2 adrenergic receptor antagonist,ANTAGONIST,CHEMBL213; CHEMBL210,2,direct
NEBIVOLOL HYDROCHLORIDE; VALSARTAN,VYDUO,Cardiovascular,CHRONIC,chemical,CHEMBL1201731 | CHEMBL1069,ADRB1 | ADRB2 | AGTR1,Beta-1 adrenergic receptor | Beta-2 adrenergic receptor | Type-1 angiotensin II receptor,Beta-1 adrenergic receptor antagonist; Beta-2 adrenergic receptor antagonist; Type-1 angiotensin II receptor antagonist,ANTAGONIST,CHEMBL213; CHEMBL210; CHEMBL227,3,combination
NEDOSIRAN SODIUM,RIVFLOZA,Other/Unclassified,OTHER,nucleicAcid,CHEMBL4594338,,L-lactate dehydrogenase A chain mRNA,L-lactate dehydrogenase A chain mRNA RNAi inhibitor,RNAI INHIBITOR,CHEMBL4627242,1,direct
NEFAZODONE HYDROCHLORIDE,NEFAZODONE HYDROCHLORIDE,Psychiatric,CHRONIC,chemical,CHEMBL1200492,SLC6A4 | HTR2A | HTR2C | SLC6A2,Sodium-dependent serotonin transporter | 5-hydroxytryptamine receptor 2A | 5-hydroxytryptamine receptor 2C | Sodium-dependent noradrenaline transporter,Serotonin transporter inhibitor; Serotonin 2a (5-HT2a) receptor antagonist; Serotonin 2c (5-HT2c) receptor antagonist; Norepinephrine transporter inhibitor,INHIBITOR | ANTAGONIST,CHEMBL228; CHEMBL224; CHEMBL225; CHEMBL222,4,direct
NELARABINE,ARRANON | NELARABINE,Oncology,LONG-TERM,chemical,CHEMBL1201112,,DNA,DNA inhibitor,INHIBITOR,CHEMBL2311221,1,direct
NELFINAVIR MESYLATE,VIRACEPT,Infectious,CHRONIC,chemical,CHEMBL1205,pol,Human immunodeficiency virus type 1 protease,Human immunodeficiency virus type 1 protease inhibitor,INHIBITOR,CHEMBL243,1,direct
NEOMYCIN SULFATE,NEOMYCIN SULFATE,Infectious,SHORT,mixture,CHEMBL3989769,"rpsB, rplD, rpsA, rpsJ, rpsK, rpsL, rpsM, rpsN, rpsO, rpsP, rpsQ, rpsR, rpsS, rpsT, rpsU, rpsC, rpsD, rpsE, rpsF, rpsG, rpsH, rpsI, rplJ, rplK, rplM, rplN, rplO, rplP, rplQ, rplR, rplS, rplA, rplT, rplU, rplV, rplW, rplX, rplY, rpmA, rpmB, rpmC, rplB, rpmD, ykgM, rpmE, rpmF, rpmG, rpmH, rpmI, ykgO, rpmJ, rplC, rplE, rplF, rplL",Bacterial 70S ribosome,Bacterial 70S ribosome inhibitor,INHIBITOR,CHEMBL2363135,1,direct
NEOMYCIN SULFATE; POLYMYXIN B SULFATE,NEOMYCIN AND POLYMYXIN B SULFATE,Infectious,SHORT,mixture,CHEMBL3989769 | CHEMBL5314355,"rpsB, rplD, rpsA, rpsJ, rpsK, rpsL, rpsM, rpsN, rpsO, rpsP, rpsQ, rpsR, rpsS, rpsT, rpsU, rpsC, rpsD, rpsE, rpsF, rpsG, rpsH, rpsI, rplJ, rplK, rplM, rplN, rplO, rplP, rplQ, rplR, rplS, rplA, rplT, rplU, rplV, rplW, rplX, rplY, rpmA, rpmB, rpmC, rplB, rpmD, ykgM, rpmE, rpmF, rpmG, rpmH, rpmI, ykgO, rpmJ, rplC, rplE, rplF, rplL",Bacterial 70S ribosome | Cell outer membrane,Bacterial 70S ribosome inhibitor; Cell outer membrane inhibitor,INHIBITOR,CHEMBL2363135; CHEMBL2364032,2,combination
NEOSTIGMINE METHYLSULFATE,BLOXIVERZ | NEOSTIGMINE METHYLSULFATE,Other,SHORT,chemical,CHEMBL211471,ACHE,Acetylcholinesterase,Acetylcholinesterase inhibitor,INHIBITOR,CHEMBL220,1,direct
NEPAFENAC,ILEVRO | NEVANAC,Other/Unclassified,OTHER,chemical,CHEMBL1021,"PTGS2, PTGS1",Cyclooxygenase,Cyclooxygenase inhibitor,INHIBITOR,CHEMBL2094253,1,direct
NERANDOMILAST,JASCAYD,Other/Unclassified,OTHER,chemical,,,,,,,0,not_found
NERATINIB MALEATE,NERLYNX,Oncology,LONG-TERM,chemical,CHEMBL3989921,ERBB2 | EGFR | ERBB4,Receptor tyrosine-protein kinase erbB-2 | Epidermal growth factor receptor | Receptor tyrosine-protein kinase erbB-4,Receptor protein-tyrosine kinase erbB-2 inhibitor; Epidermal growth factor receptor erbB1 inhibitor; Receptor protein-tyrosine kinase erbB-4 inhibitor,INHIBITOR,CHEMBL1824; CHEMBL203; CHEMBL3009,3,direct
NETARSUDIL MESYLATE,RHOPRESSA,Ophthalmology,CHRONIC,chemical,CHEMBL4594251,"ROCK2, ROCK1",Rho-associated protein kinase,Rho-associated protein kinase inhibitor,INHIBITOR,CHEMBL2111459,1,direct
NETUPITANT; PALONOSETRON HYDROCHLORIDE,AKYNZEO,GI,SHORT,chemical,CHEMBL206253 | CHEMBL1720,TACR1 | HTR3A,Substance-P receptor | 5-hydroxytryptamine receptor 3A,Neurokinin 1 receptor antagonist; Serotonin 3a (5-HT3a) receptor antagonist,ANTAGONIST,CHEMBL249; CHEMBL1899,2,combination
NEVIRAPINE,NEVIRAPINE,Psychiatric,CHRONIC,chemical,CHEMBL57,pol,Human immunodeficiency virus type 1 reverse transcriptase,Human immunodeficiency virus type 1 reverse transcriptase inhibitor,INHIBITOR,CHEMBL247,1,direct
NIACIN,NIACIN | NIACOR,Metabolic,CHRONIC,chemical,,,,,,,0,not_found
NICARDIPINE HYDROCHLORIDE,CARDENE | CARDENE IN 0.83% SODIUM CHLORIDE IN PLASTIC CONTAINER | CARDENE IN 0.86% SODIUM CHLORIDE IN PLASTIC CONTAINER | CARDENE IN 4.8% DEXTROSE IN PLASTIC CONTAINER | NICARDIPINE HYDROCHLORIDE | NICARDIPINE HYDROCHLORIDE IN 0.83% SODIUM CHLORIDE | NICARDIPINE HYDROCHLORIDE IN 0.86% SODIUM CHLORIDE | NICARDIPINE HYDROCHLORIDE IN 0.9% SODIUM CHLORIDE,Cardiovascular,CHRONIC,chemical,CHEMBL1200326,"CACNA1C, CACNA1S, CACNA1D, CACNA1F",Voltage-gated L-type calcium channel,Voltage-gated L-type calcium channel blocker,BLOCKER,CHEMBL2095229,1,direct
NICOTINE,HABITROL | NICODERM CQ | NICOTINE | NICOTROL,Psychiatric,SHORT,chemical,CHEMBL3,"CHRNB2, CHRNA4",Neuronal acetylcholine receptor; alpha4/beta2,Neuronal acetylcholine receptor; alpha4/beta2 agonist,AGONIST,CHEMBL1907589,1,direct
NICOTINE POLACRILEX,NICORETTE | NICORETTE (MINT) | NICOTINE POLACRILEX,Psychiatric,SHORT,concept,CHEMBL1201536,"CHRNB2, CHRNA4",Neuronal acetylcholine receptor; alpha4/beta2,Neuronal acetylcholine receptor; alpha4/beta2 agonist,AGONIST,CHEMBL1907589,1,direct
NIFEDIPINE,NIFEDIPINE | PROCARDIA XL,Cardiovascular,CHRONIC,chemical,CHEMBL193,"CACNA1C, CACNA1S, CACNA1D, CACNA1F",Voltage-gated L-type calcium channel,Voltage-gated L-type calcium channel blocker,BLOCKER,CHEMBL2095229,1,direct
NIFURTIMOX,LAMPIT,Other/Unclassified,OTHER,chemical,CHEMBL290960,,DNA,DNA inhibitor,INHIBITOR,CHEMBL4495551,1,direct
NILOTINIB,CAVHANZA,Oncology,LONG-TERM,chemical,,,,,,,0,not_found
NILOTINIB D-TARTRATE,NILOTINIB D-TARTRATE,Oncology,LONG-TERM,chemical,,,,,,,0,not_found
NILOTINIB HYDROCHLORIDE,NILOTINIB HYDROCHLORIDE | TASIGNA,Oncology,LONG-TERM,chemical,CHEMBL1201740,"ABL1 | ABL1, BCR",Tyrosine-protein kinase ABL1 | Bcr/Abl fusion protein,Tyrosine-protein kinase ABL inhibitor; Bcr/Abl fusion protein inhibitor,INHIBITOR,CHEMBL1862; CHEMBL2096618,2,direct
NILOTINIB TARTRATE,DANZITEN,Oncology,LONG-TERM,chemical,,,,,,,0,not_found
NILUTAMIDE,NILUTAMIDE,Oncology,LONG-TERM,chemical,CHEMBL1274,AR,Androgen receptor,Androgen Receptor antagonist,ANTAGONIST,CHEMBL1871,1,direct
NIMODIPINE,NIMODIPINE | NYMALIZE,Cardiovascular,CHRONIC,chemical,CHEMBL1428,"NR3C2 | CACNA1C, CACNA1S, CACNA1D, CACNA1F",Mineralocorticoid receptor | Voltage-gated L-type calcium channel,Mineralocorticoid receptor antagonist; Voltage-gated L-type calcium channel blocker,ANTAGONIST | BLOCKER,CHEMBL1994; CHEMBL2095229,2,direct
NINTEDANIB ESYLATE,NINTEDANIB ESYLATE | OFEV,Other/Unclassified,OTHER,chemical,CHEMBL3039504,"PDGFRB, PDGFRA | FLT1, FLT4, KDR | FGFR3, FGFR1, FGFR4, FGFR2",Platelet-derived growth factor receptor | Vascular endothelial growth factor receptor | Fibroblast growth factor receptor,Platelet-derived growth factor receptor inhibitor; Vascular endothelial growth factor receptor inhibitor; Fibroblast growth factor receptor inhibitor,INHIBITOR,CHEMBL2095189; CHEMBL2095227; CHEMBL2095217,3,direct
NIRAPARIB TOSYLATE,ZEJULA,Oncology,LONG-TERM,chemical,CHEMBL3989922,PARP2 | PARP1,Poly [ADP-ribose] polymerase 2 | Poly [ADP-ribose] polymerase 1,Poly [ADP-ribose] polymerase 2 inhibitor; Poly [ADP-ribose] polymerase-1 inhibitor,INHIBITOR,CHEMBL5366; CHEMBL3105,2,direct
NIRMATRELVIR; RITONAVIR,PAXLOVID (COPACKAGED),Infectious,CHRONIC,chemical,CHEMBL4802135 | CHEMBL163,"pol | CYP3A4, CYP3A5, CYP3A43, CYP3A7",Replicase polyprotein 1a | Human immunodeficiency virus type 1 protease | Cytochrome P450 3A,SARS coronavirus 3C-like proteinase inhibitor; Human immunodeficiency virus type 1 protease inhibitor; Cytochrome P450 3A inhibitor,INHIBITOR,CHEMBL3927; CHEMBL243; CHEMBL2364675,3,combination
NIROGACESTAT HYDROBROMIDE,OGSIVEO,Other/Unclassified,OTHER,chemical,CHEMBL4298153,"APH1A, PSENEN, APH1B, PSEN1, NCSTN, PSEN2",Gamma-secretase,Gamma-secretase inhibitor,INHIBITOR,CHEMBL2094135,1,direct
NISOLDIPINE,NISOLDIPINE | SULAR,Cardiovascular,CHRONIC,chemical,CHEMBL1726,"CACNA1C, CACNA1S, CACNA1D, CACNA1F",Voltage-gated L-type calcium channel,Voltage-gated L-type calcium channel blocker,BLOCKER,CHEMBL2095229,1,direct
NITAZOXANIDE,NITAZOXANIDE,Other/Unclassified,OTHER,chemical,CHEMBL1401,PFOR,Pyruvate dehydrogenase [NADP(+)] | Pyruvate:ferredoxin oxidoreductase,Pyruvate:ferredoxin oxidoreductase inhibitor,INHIBITOR,CHEMBL2364026; CHEMBL2364027,2,direct
NITISINONE,HARLIKU | NITISINONE | NITYR | ORFADIN,Metabolic,CHRONIC,chemical,CHEMBL1337,HPD,4-hydroxyphenylpyruvate dioxygenase,4-hydroxyphenylpyruvate dioxygenase inhibitor,INHIBITOR,CHEMBL1861,1,direct
NITRIC OXIDE,GENOSYL | INOMAX | NOXIVENT | ULSPIRA,Other/Unclassified,OTHER,chemical,CHEMBL1200689,"GUCY1B1, GUCY1B2, GUCY1A2, GUCY1A1",Soluble guanylate cyclase,Soluble guanylate cyclase activator,ACTIVATOR,CHEMBL2111348,1,direct
NITROFURANTOIN,FURADANTIN | NITROFURANTOIN,Infectious,SHORT,chemical,CHEMBL572,,DNA,DNA inhibitor,INHIBITOR,CHEMBL2364041,1,direct
"NITROFURANTOIN, MACROCRYSTALLINE",MACRODANTIN | NITROFURANTOIN,Infectious,SHORT,chemical,CHEMBL572,,DNA,DNA inhibitor,INHIBITOR,CHEMBL2364041,1,direct
"NITROFURANTOIN; NITROFURANTOIN, MACROCRYSTALLINE",MACROBID | NITROFURANTOIN (MONOHYDRATE/MACROCRYSTALS),Infectious,SHORT,chemical,CHEMBL572 | CHEMBL572,,DNA,DNA inhibitor,INHIBITOR,CHEMBL2364041,1,combination
NITROGLYCERIN,NITRO-DUR | NITROGLYCERIN | NITROGLYCERIN IN DEXTROSE 5% | NITROLINGUAL PUMPSPRAY | NITROMIST | NITROSTAT,Cardiovascular,PERIODIC,chemical,CHEMBL730,"GUCY1B1, GUCY1B2, GUCY1A2, GUCY1A1",Soluble guanylate cyclase,Soluble guanylate cyclase activator,ACTIVATOR,CHEMBL2111348,1,direct
NIZATIDINE,AXID AR | NIZATIDINE,GI,CHRONIC,chemical,CHEMBL3183075,HRH2,Histamine H2 receptor,Histamine H2 receptor antagonist,ANTAGONIST,CHEMBL1941,1,direct
NOREPINEPHRINE BITARTRATE,LEVOPHED | NOREPINEPHRINE BITARTRATE | NOREPINEPHRINE BITARTRATE IN 0.9% SODIUM CHLORIDE | NOREPINEPHRINE BITARTRATE IN 5% DEXTROSE,Cardiovascular,SHORT,chemical,CHEMBL1434513,"ADRA1A, ADRA2A, ADRB1, ADRB2, ADRA2C, ADRA1D, ADRA1B, ADRA2B, ADRB3",Adrenergic receptor,Adrenergic receptor agonist,AGONIST,CHEMBL2331074,1,direct
NORETHINDRONE,CAMILA | EMZAHH | ERRIN | HEATHER | INCASSIA | JENCYCLA | NOR-QD | NORETHINDRONE,Metabolic,CHRONIC,chemical,CHEMBL1162,PGR,Progesterone receptor,Progesterone receptor agonist,AGONIST,CHEMBL208,1,direct
NORETHINDRONE ACETATE,NORETHINDRONE ACETATE,Metabolic,CHRONIC,chemical,CHEMBL1201146,PGR,Progesterone receptor,Progesterone receptor agonist,AGONIST,CHEMBL208,1,direct
NORGESTREL,OPILL,Metabolic,CHRONIC,chemical,CHEMBL2107797,PGR,Progesterone receptor,Progesterone receptor agonist,AGONIST,CHEMBL208,1,direct
NORTRIPTYLINE HYDROCHLORIDE,NORTRIPTYLINE HYDROCHLORIDE,Psychiatric,CHRONIC,chemical,CHEMBL1201156,SLC6A4 | SLC6A2,Sodium-dependent serotonin transporter | Sodium-dependent noradrenaline transporter,Serotonin transporter inhibitor; Norepinephrine transporter inhibitor,INHIBITOR,CHEMBL228; CHEMBL222,2,direct
NUSINERSEN SODIUM,SPINRAZA,Other/Unclassified,OTHER,nucleicAcid,CHEMBL3833342,,SMN2 pre-mRNA,SMN2 pre-mRNA positive modulator,POSITIVE MODULATOR,CHEMBL3826841,1,direct
NYSTATIN,KLAYESTA | NILSTAT | NYSTATIN | NYSTOP,Metabolic,CHRONIC,mixture,CHEMBL5465559,,Ergosterol,Ergosterol sequestering agent,SEQUESTERING AGENT,CHEMBL2364028,1,direct
NYSTATIN; TRIAMCINOLONE ACETONIDE,NYSTATIN AND TRIAMCINOLONE ACETONIDE,Metabolic,CHRONIC,mixture,CHEMBL5465559 | CHEMBL1504,NR3C1,Ergosterol | Glucocorticoid receptor,Ergosterol sequestering agent; Glucocorticoid receptor agonist,SEQUESTERING AGENT | AGONIST,CHEMBL2364028; CHEMBL2034,2,combination
OCTREOTIDE ACETATE,BYNFEZIA PEN | MYCAPSSA | OCTREOTIDE ACETATE | OCTREOTIDE ACETATE (PRESERVATIVE FREE) | SANDOSTATIN | SANDOSTATIN LAR,GI,CHRONIC,chemical,CHEMBL1200480,"SSTR5, SSTR2, SSTR4, SSTR1, SSTR3",Somatostatin receptor,Somatostatin receptor agonist,AGONIST,CHEMBL2111436,1,direct
ODEVIXIBAT,BYLVAY,Other/Unclassified,OTHER,chemical,CHEMBL4297588,SLC10A2,Ileal sodium/bile acid cotransporter,Ileal bile acid transporter inhibitor,INHIBITOR,CHEMBL2778,1,direct
OFLOXACIN,OCUFLOX | OFLOXACIN,Infectious,SHORT,chemical,CHEMBL4,"gyrB, gyrA",Bacterial DNA gyrase,Bacterial DNA gyrase inhibitor,INHIBITOR,CHEMBL2311224,1,direct
OLANZAPINE,OLANZAPINE | ZYPREXA | ZYPREXA ZYDIS,Psychiatric,CHRONIC,chemical,CHEMBL715,"HTR2A | HTR2C | DRD2, DRD3, DRD4",5-hydroxytryptamine receptor 2A | 5-hydroxytryptamine receptor 2C | D2-like dopamine receptor,Serotonin 2a (5-HT2a) receptor antagonist; Serotonin 2c (5-HT2c) receptor antagonist; D2-like dopamine receptor antagonist,ANTAGONIST,CHEMBL224; CHEMBL225; CHEMBL2331075,3,direct
OLANZAPINE PAMOATE,ZYPREXA RELPREVV,Psychiatric,CHRONIC,chemical,CHEMBL3989694,"HTR2A | HTR2C | DRD2, DRD3, DRD4",5-hydroxytryptamine receptor 2A | 5-hydroxytryptamine receptor 2C | D2-like dopamine receptor,Serotonin 2a (5-HT2a) receptor antagonist; Serotonin 2c (5-HT2c) receptor antagonist; D2-like dopamine receptor antagonist,ANTAGONIST,CHEMBL224; CHEMBL225; CHEMBL2331075,3,direct
OLANZAPINE; SAMIDORPHAN L-MALATE,LYBALVI,Psychiatric,CHRONIC,chemical,CHEMBL715 | CHEMBL2105749,"HTR2A | HTR2C | DRD2, DRD3, DRD4 | OPRK1 | OPRD1 | OPRM1",5-hydroxytryptamine receptor 2A | 5-hydroxytryptamine receptor 2C | D2-like dopamine receptor | Kappa-type opioid receptor | Delta-type opioid receptor | Mu-type opioid receptor,Serotonin 2a (5-HT2a) receptor antagonist; Serotonin 2c (5-HT2c) receptor antagonist; D2-like dopamine receptor antagonist; Kappa opioid receptor partial agonist; Delta opioid receptor partial agonist; Mu opioid receptor antagonist,ANTAGONIST | PARTIAL AGONIST,CHEMBL224; CHEMBL225; CHEMBL2331075; CHEMBL237; CHEMBL236; CHEMBL233,6,combination
OLAPARIB,LYNPARZA,Oncology,LONG-TERM,chemical,CHEMBL521686,"PARP1, PARP3, PARP2","PARP 1, 2 and 3","PARP 1, 2 and 3 inhibitor",INHIBITOR,CHEMBL3390820,1,direct
OLEZARSEN SODIUM,TRYNGOLZA (AUTOINJECTOR),Other/Unclassified,OTHER,nucleicAcid,,,,,,,0,not_found
OLIVE OIL; SOYBEAN OIL,CLINOLIPID 20%,Other/Unclassified,OTHER,structurallyDiverse,,,,,,,0,not_found
OLMESARTAN MEDOXOMIL,BENICAR | OLMESARTAN MEDOXOMIL,Cardiovascular,CHRONIC,chemical,CHEMBL1200692,AGTR1,Type-1 angiotensin II receptor,Type-1 angiotensin II receptor antagonist,ANTAGONIST,CHEMBL227,1,direct
OLODATEROL HYDROCHLORIDE,STRIVERDI RESPIMAT,Respiratory,CHRONIC,chemical,CHEMBL2105743,ADRB2,Beta-2 adrenergic receptor,Beta-2 adrenergic receptor agonist,AGONIST,CHEMBL210,1,direct
OLODATEROL HYDROCHLORIDE; TIOTROPIUM BROMIDE,STIOLTO RESPIMAT,Respiratory,CHRONIC,chemical,CHEMBL2105743 | CHEMBL3545181,ADRB2 | CHRM3,Beta-2 adrenergic receptor | Muscarinic acetylcholine receptor M3,Beta-2 adrenergic receptor agonist; Muscarinic acetylcholine receptor M3 antagonist,AGONIST | ANTAGONIST,CHEMBL210; CHEMBL245,2,combination
OLOPATADINE HYDROCHLORIDE,OLOPATADINE HYDROCHLORIDE | PATADAY ONCE DAILY RELIEF | PATADAY TWICE DAILY RELIEF,Ophthalmology,PERIODIC,chemical,CHEMBL1719,HRH1,Histamine H1 receptor,Histamine H1 receptor antagonist,ANTAGONIST,CHEMBL231,1,direct
OLSALAZINE SODIUM,DIPENTUM,GI,CHRONIC,chemical,CHEMBL1201013,"ALOX5 | PPARG | PTGS2, PTGS1",Polyunsaturated fatty acid 5-lipoxygenase | Peroxisome proliferator-activated receptor gamma | Cyclooxygenase,Arachidonate 5-lipoxygenase inhibitor; Peroxisome proliferator-activated receptor gamma agonist; Cyclooxygenase inhibitor,INHIBITOR | AGONIST,CHEMBL215; CHEMBL235; CHEMBL2094253,3,direct
OLUTASIDENIB,REZLIDHIA,Oncology,LONG-TERM,chemical,CHEMBL4297610,IDH1,Isocitrate dehydrogenase [NADP] cytoplasmic,Isocitrate dehydrogenase [NADP] cytoplasmic inhibitor,INHIBITOR,CHEMBL2007625,1,direct
OMADACYCLINE TOSYLATE,NUZYRA,Infectious,SHORT,chemical,CHEMBL2103854,"rpsB, rplD, rpsA, rpsJ, rpsK, rpsL, rpsM, rpsN, rpsO, rpsP, rpsQ, rpsR, rpsS, rpsT, rpsU, rpsC, rpsD, rpsE, rpsF, rpsG, rpsH, rpsI, rplJ, rplK, rplM, rplN, rplO, rplP, rplQ, rplR, rplS, rplA, rplT, rplU, rplV, rplW, rplX, rplY, rpmA, rpmB, rpmC, rplB, rpmD, ykgM, rpmE, rpmF, rpmG, rpmH, rpmI, ykgO, rpmJ, rplC, rplE, rplF, rplL",Bacterial 70S ribosome,Bacterial 70S ribosome inhibitor,INHIBITOR,CHEMBL2363135,1,direct
OMAVELOXOLONE,SKYCLARYS,Other/Unclassified,OTHER,chemical,CHEMBL4303525,NFE2L2,Nuclear factor erythroid 2-related factor 2,Nuclear factor erythroid 2-related factor 2 activator,ACTIVATOR,CHEMBL1075094,1,direct
OMEGA-3-ACID ETHYL ESTERS,LOVAZA | OMEGA-3-ACID ETHYL ESTERS,Metabolic,CHRONIC,mixture,CHEMBL1200711,,,Unknown,,,0,direct
OMEPRAZOLE,OMEPRAZOLE,GI,CHRONIC,chemical,CHEMBL1503,"ATP4A, ATP4B",Potassium-transporting ATPase,Potassium-transporting ATPase inhibitor,INHIBITOR,CHEMBL2095173,1,direct
OMEPRAZOLE MAGNESIUM,OMEPRAZOLE MAGNESIUM | PRILOSEC | PRILOSEC OTC,GI,CHRONIC,chemical,CHEMBL1567328,"ATP4A, ATP4B",Potassium-transporting ATPase,Potassium-transporting ATPase inhibitor,INHIBITOR,CHEMBL2095173,1,direct
OMEPRAZOLE; SODIUM BICARBONATE,KONVOMEP | OMEPRAZOLE AND SODIUM BICARBONATE | ZEGERID OTC,GI,CHRONIC,chemical,CHEMBL1503,"ATP4A, ATP4B",Potassium-transporting ATPase,Potassium-transporting ATPase inhibitor,INHIBITOR,CHEMBL2095173,1,component
OMIDENEPAG ISOPROPYL,OMLONTI,Ophthalmology,CHRONIC,chemical,CHEMBL4297666,PTGER2,Prostaglandin E2 receptor EP2 subtype,Prostanoid EP2 receptor agonist,AGONIST,CHEMBL1881,1,direct
ONDANSETRON,ONDANSETRON,GI,PERIODIC,chemical,CHEMBL46,HTR3A,5-hydroxytryptamine receptor 3A,Serotonin 3a (5-HT3a) receptor antagonist,ANTAGONIST,CHEMBL1899,1,direct
ONDANSETRON HYDROCHLORIDE,ONDANSETRON HYDROCHLORIDE | ONDANSETRON HYDROCHLORIDE PRESERVATIVE FREE,GI,PERIODIC,chemical,CHEMBL3186492,HTR3A,5-hydroxytryptamine receptor 3A,Serotonin 3a (5-HT3a) receptor antagonist,ANTAGONIST,CHEMBL1899,1,direct
OPICAPONE,ONGENTYS,Other/Unclassified,OTHER,chemical,CHEMBL1089318,COMT,Catechol O-methyltransferase,Catechol O-methyltransferase inhibitor,INHIBITOR,CHEMBL2023,1,direct
ORFORGLIPRON CALCIUM,FOUNDAYO,Other/Unclassified,OTHER,chemical,,,,,,,0,not_found
ORITAVANCIN DIPHOSPHATE,KIMYRSA | ORBACTIV,Other/Unclassified,OTHER,chemical,CHEMBL3989766,,Peptidoglycan,Peptidoglycan inhibitor,INHIBITOR,CHEMBL3041361,1,direct
ORLISTAT,ALLI | XENICAL,Metabolic,CHRONIC,chemical,CHEMBL175247,LIPF | PNLIP,Gastric triacylglycerol lipase | Pancreatic triacylglycerol lipase,Gastric lipase inhibitor; Pancreatic lipase inhibitor,INHIBITOR,CHEMBL1796; CHEMBL1812,2,direct
ORPHENADRINE CITRATE,ORPHENADRINE CITRATE,Pain,PERIODIC,chemical,CHEMBL1200395,"HRH1 | SLC6A2 | GRIN1, GRIN2A, GRIN2B, GRIN2D, GRIN3B, GRIN2C, GRIN3A | SCN1A, SCN5A, SCN4A, SCN7A, SCN2A, SCN9A, SCN3A, SCN11A, SCN8A, SCN10A",Histamine H1 receptor | Sodium-dependent noradrenaline transporter | Glutamate [NMDA] receptor | Sodium channel alpha subunit,Histamine H1 receptor antagonist; Norepinephrine transporter inhibitor; Glutamate [NMDA] receptor antagonist; Sodium channel alpha subunit blocker,ANTAGONIST | INHIBITOR | BLOCKER,CHEMBL231; CHEMBL222; CHEMBL2094124; CHEMBL2331043,4,direct
OSELTAMIVIR PHOSPHATE,OSELTAMIVIR PHOSPHATE | TAMIFLU,Infectious,SHORT,chemical,CHEMBL1200340,NA,Neuraminidase,Neuraminidase inhibitor,INHIBITOR,CHEMBL2051; CHEMBL3377,2,direct
OSILODROSTAT PHOSPHATE,ISTURISA,Metabolic,CHRONIC,chemical,CHEMBL3707393,CYP11B1,"Cytochrome P450 11B1, mitochondrial",Cytochrome P450 11B1 inhibitor,INHIBITOR,CHEMBL1908,1,direct
OSIMERTINIB MESYLATE,TAGRISSO,Oncology,LONG-TERM,chemical,CHEMBL3545063,EGFR,Epidermal growth factor receptor,Epidermal growth factor receptor erbB1 inhibitor,INHIBITOR,CHEMBL203,1,direct
OSPEMIFENE,OSPHENA,Other/Unclassified,OTHER,chemical,CHEMBL2105395,"ESR2, ESR1",Estrogen receptor,Estrogen receptor modulator,MODULATOR,CHEMBL2093866,1,direct
OTESECONAZOLE,VIVJOA,Infectious,SHORT,chemical,CHEMBL3311228,ERG11,Lanosterol 14-alpha demethylase,Lanosterol 14-alpha demethylase inhibitor,INHIBITOR,CHEMBL4662933,1,direct
OXACILLIN SODIUM,BACTOCILL IN PLASTIC CONTAINER | OXACILLIN SODIUM,Infectious,SHORT,chemical,CHEMBL3989567,"pbp4, pbpF, mecA, pbp2, pbpA",Penicillin-binding protein,Penicillin-binding protein inhibitor,INHIBITOR,CHEMBL2362972,1,direct
OXALIPLATIN,OXALIPLATIN,Oncology,SHORT,chemical,CHEMBL414804,,DNA,DNA inhibitor,INHIBITOR,CHEMBL2311221,1,direct
OXAPROZIN,COXANTO | DAYPRO | OXAPROZIN,Pain,PERIODIC,chemical,CHEMBL1071,"PTGS2, PTGS1",Cyclooxygenase,Cyclooxygenase inhibitor,INHIBITOR,CHEMBL2094253,1,direct
OXAZEPAM,OXAZEPAM,Psychiatric,PERIODIC,chemical,CHEMBL568,"GABRA1, GABRB2, GABRG2, GABRB3, GABRA4, GABRG3, GABRQ, GABRA3, GABRP, GABRD, GABRG1, GABRB1, GABRE, GABRA2, GABRA5, GABRA6",GABA-A receptor; anion channel,GABA-A receptor; anion channel positive allosteric modulator,POSITIVE ALLOSTERIC MODULATOR,CHEMBL2093872,1,direct
OXCARBAZEPINE,OXCARBAZEPINE | OXTELLAR XR | TRILEPTAL,Psychiatric,CHRONIC,chemical,CHEMBL1068,"SCN1A, SCN5A, SCN4A, SCN7A, SCN2A, SCN9A, SCN3A, SCN11A, SCN8A, SCN10A",Sodium channel alpha subunit,Sodium channel alpha subunit blocker,BLOCKER,CHEMBL2331043,1,direct
OXICONAZOLE NITRATE,OXICONAZOLE NITRATE | OXISTAT,Infectious,SHORT,chemical,CHEMBL1200836,ERG11,Lanosterol 14-alpha demethylase,Cytochrome P450 51 inhibitor,INHIBITOR,CHEMBL1780,1,direct
OXYBUTYNIN,OXYTROL | OXYTROL FOR WOMEN,Neurology,CHRONIC,chemical,CHEMBL1231,CHRM3 | CHRM2,Muscarinic acetylcholine receptor M3 | Muscarinic acetylcholine receptor M2,Muscarinic acetylcholine receptor M3 antagonist; Muscarinic acetylcholine receptor M2 antagonist,ANTAGONIST,CHEMBL245; CHEMBL211,2,direct
OXYBUTYNIN CHLORIDE,OXYBUTYNIN CHLORIDE,Neurology,CHRONIC,chemical,CHEMBL1133,CHRM3 | CHRM2,Muscarinic acetylcholine receptor M3 | Muscarinic acetylcholine receptor M2,Muscarinic acetylcholine receptor M3 antagonist; Muscarinic acetylcholine receptor M2 antagonist,ANTAGONIST,CHEMBL245; CHEMBL211,2,direct
OXYCODONE,XTAMPZA ER,Pain,CHRONIC,chemical,CHEMBL656,OPRM1,Mu-type opioid receptor,Mu opioid receptor agonist,AGONIST,CHEMBL233,1,direct
OXYCODONE HYDROCHLORIDE,OXYCODONE HYDROCHLORIDE | OXYCONTIN | ROXICODONE | ROXYBOND,Pain,CHRONIC,chemical,CHEMBL1200890,OPRM1,Mu-type opioid receptor,Mu opioid receptor agonist,AGONIST,CHEMBL233,1,direct
